<?xml version="1.0" encoding="UTF-8"?>
<spyTable xmlns:xsi="http://www.w3.org/2001/XMLSchema-instance" xsi:noNamespaceSchemaLocation="SpyBase2.xsd">
	<spyRow spyID="A001">
		<firstName>Nikki</firstName>
		<lastName>Devgood</lastName>
		<aliasRow aID="1">
			<alias>Spy Grrrl</alias>
		</aliasRow>
		<aliasRow aID="2">
			<alias>La Femme Nikki</alias>
		</aliasRow>
		<missionRow mID="M101">
			<date>2005-04-15</date>
			<description>Crack the code</description>
			<status>Mission Accomplished</status>
		</missionRow>
		<missionRow mID="M102">
			<date>2006-02-15</date>
			<description>Get the source</description>
			<status>Mission Accomplished</status>
		</missionRow>
		<missionRow mID="M103">
			<date>2006-05-04</date>
			<description>Hit the target</description>
			<status>In Progress</status>
		</missionRow>
	</spyRow>
	<spyRow spyID="A006">
		<firstName>Link</firstName>
		<lastName>Lister</lastName>
		<aliasRow aID="3">
			<alias>LL</alias>
		</aliasRow>
		<aliasRow aID="4">
			<alias>Fred</alias>
		</aliasRow>
		<missionRow mID="M104">
			<date>2006-06-15</date>
			<description>Shoot the rapid</description>
			<status>In Progress</status>
		</missionRow>
	</spyRow>
	<spyRow spyID="A003">
		<firstName>Danger</firstName>
		<lastName>Mause</lastName>
		<aliasRow aID="5">
			<alias>Big Ears</alias>
		</aliasRow>
		<missionRow mID="M105">
			<date>2005-11-04</date>
			<description>Get the big cheese</description>
			<status>In Progress</status>
		</missionRow>
		<missionRow mID="M106">
			<date>2006-04-04</date>
			<description>Map the area</description>
			<status>In Progress</status>
		</missionRow>
	</spyRow>
	<spyRow spyID="A099">
		<firstName>Barbara</firstName>
		<lastName>Feldon</lastName>
		<missionRow mID="M107">
			<date>2006-05-02</date>
			<description>Get Smart</description>
			<status>In Progress</status>
		</missionRow>
	</spyRow>
	<spyRow spyID="A004">
		<firstName>Maxwell</firstName>
		<lastName>Smart</lastName>
		<aliasRow aID="6">
			<alias>Inspector Gadget</alias>
		</aliasRow>
		<aliasRow aID="7">
			<alias>Don Adams</alias>
		</aliasRow>
		<missionRow mID="M108">
			<date>1967-02-15</date>
			<description>Protect Chief</description>
			<status>In Progress</status>
		</missionRow>
		<missionRow mID="M109">
			<date>2006-06-15</date>
			<description>Get some style</description>
			<status>Mission Accomplished</status>
		</missionRow>
	</spyRow>
</spyTable>
